{
  "schemaVersion": "maliev.cnc-tool-catalog.v1",
  "checkedOn": "2026-09-06",
  "units": "millimeter",
  "purpose": "Local source facts for review and later integration. Catalog presence is not shop ownership, stock, holder clearance, material suitability, cutting-condition evidence or machining authorization.",
  "sources": [
    {
      "id": "misumi-flat",
      "publisher": "MISUMI Thailand",
      "sourceUrl": "https://th.misumi-ec.com/en/vona2/detail/110600002430/",
      "checkedOn": "2026-09-06",
      "status": "checked_primary_source",
      "notes": "Specifications table; numeric rows inspected. Ordering variants and current Thai stock are not established."
    },
    {
      "id": "misumi-neck",
      "publisher": "MISUMI Thailand",
      "sourceUrl": "https://th.misumi-ec.com/en/vona2/detail/110600004440/",
      "checkedOn": "2026-09-06",
      "status": "checked_primary_source",
      "notes": "Specifications table with merged row groups; D, flute length, under-neck length and shank diameter are distinct."
    },
    {
      "id": "misumi-neck-pdf",
      "publisher": "MISUMI Thailand",
      "sourceUrl": "https://th.misumi-ec.com/th/pdf/vona/156-159-1.pdf",
      "checkedOn": "2026-09-06",
      "status": "checked_primary_source",
      "notes": "Historical dimensional catalog pages 156-159; used to cross-check column definitions, not stock or current prices."
    },
    {
      "id": "osg-spot",
      "publisher": "OSG",
      "sourceUrl": "https://osgtool.com/content/literature/8002024CA/List%201200%20-%20EX-GOLD%20TIN-NC-LDS.pdf",
      "checkedOn": "2026-09-06",
      "status": "checked_primary_source",
      "notes": "List 1200, page 254. Minimum subsequent drill-hole size is not the spot tip diameter or full cone depth."
    },
    {
      "id": "ns-ball",
      "publisher": "NS TOOL",
      "sourceUrl": "https://www.ns-tool.com/ja/products/detail/14",
      "checkedOn": "2026-09-06",
      "status": "checked_primary_source",
      "notes": "Current official product table found by web search. Direct page fetch timed out; indexed official table checked. Neck taper angle is a reference needing physical measurement."
    },
    {
      "id": "mmc-face",
      "publisher": "Mitsubishi Materials",
      "sourceUrl": "https://www.mitsubishicarbide.net/mhg/enuk/face_mills/20000020/20066000",
      "checkedOn": "2026-09-06",
      "status": "checked_primary_source",
      "notes": "ASX445-050A04R metric dimensions: DC, DCX, DCON, LF, APMX, ZEFP. Arbor and insert grade remain unverified."
    },
    {
      "id": "osg-metric-tap",
      "publisher": "OSG",
      "sourceUrl": "https://osgtool.com/content/literature/8002024CA/List%20123%20-%20OSG%20GENERAL%20PURPOSE%20EX-SFT.pdf",
      "checkedOn": "2026-09-06",
      "status": "checked_primary_source",
      "notes": "List 123 page 549; Lc is thread length, not generic cutting flute reach."
    },
    {
      "id": "osg-imperial-tap",
      "publisher": "OSG",
      "sourceUrl": "https://osgtool.com/content/literature/8002024CA/List%20107%20-%20OSG%20GENERAL%20PURPOSE-SFT.pdf",
      "checkedOn": "2026-09-06",
      "status": "checked_primary_source",
      "notes": "List 107 pages 544-545. Inches converted using exactly 25.4 mm/in; pitch computed as 25.4/TPI."
    },
    {
      "id": "osg-thread-mill",
      "publisher": "OSG",
      "sourceUrl": "https://osgtool.com/content/literature/8002024CA/List%2041000%20-%20EXOCARB%20OT-SFT-PNGT.pdf",
      "checkedOn": "2026-09-06",
      "status": "checked_primary_source",
      "notes": "List 41000 page 410; internal threads only. Inch dimensions converted with exactly 25.4 mm/in."
    },
    {
      "id": "harvey-engraving",
      "publisher": "Harvey Tool",
      "sourceUrl": "https://www.harveytool.com/products/tool-details-993230",
      "checkedOn": "2026-09-06",
      "status": "checked_primary_source",
      "notes": "Tool 993230 dimensional fields. 0.005 inch web thickness is not a tip diameter; no tip diameter inferred."
    },
    {
      "id": "nachi-sdp",
      "publisher": "NACHI-FUJIKOSHI",
      "sourceUrl": "https://www.nachi-fujikoshi.co.jp/dcms_media/other/2003-29.pdf",
      "checkedOn": "2026-09-06",
      "status": "checked_primary_source",
      "notes": "Downloaded official 883-page PDF; inspected and rendered physical PDF page 742 (printed G-6). Diameter, flute length, overall length, point length and 118-degree HSS symbols verified; shank dimension not separately stated."
    },
    {
      "id": "misumi-vac-neck",
      "publisher": "MISUMI Thailand",
      "sourceUrl": "https://th.misumi-ec.com/en/vona2/detail/110600415160/",
      "checkedOn": "2026-09-06",
      "status": "checked_primary_source",
      "notes": "VAC-PEM2LB specification table D8/10/12 blocks; merged flute and shank cells inherited within each block. Angle-dependent effective-length guidance is not certified interference geometry."
    },
    {
      "id": "harvey-metric-single",
      "publisher": "Harvey Tool",
      "sourceUrl": "https://www.harveytool.com/products/tool-details-826530",
      "checkedOn": "2026-09-06",
      "status": "checked_primary_source",
      "notes": "Exact tool dimensions. Max Depth of Thread is retained separately from flute and under-neck lengths; no pitch bounds stated."
    },
    {
      "id": "harvey-metric-family",
      "publisher": "Harvey Tool",
      "sourceUrl": "https://www.harveytool.com/products/thread-milling-cutters---single-form---metric",
      "checkedOn": "2026-09-06",
      "status": "checked_primary_source",
      "notes": "Family introduction explicitly states internal/external metric and multiple pitches; generic bullet inconsistently says UN. No exact M14x1 pairing or numeric pitch bounds stated."
    }
  ],
  "tools": [
    {
      "id": "misumi-tsc-em2s-row-d1",
      "family": "flat_end_mill",
      "variant": "standard",
      "manufacturer": "MISUMI",
      "series": "TSC-EM2S",
      "orderCode": null,
      "recordStatus": "source_verified",
      "geometry": {
        "diameterMm": 1,
        "fluteLengthMm": 2,
        "overallLengthMm": 40,
        "shankDiameterMm": 4,
        "underNeckLengthMm": null,
        "neckDiameterMm": null,
        "ballRadiusMm": null,
        "includedAngleDegrees": null,
        "pointLengthMm": null,
        "pointDiameterMm": null,
        "maxAxialDepthMm": null,
        "maxCuttingDiameterMm": null,
        "connectionBoreDiameterMm": null,
        "functionalLengthMm": null,
        "threadLengthMm": null,
        "minimumDrillHoleDiameterMm": null,
        "maximumThreadDepthMm": null
      },
      "thread": null,
      "flutes": 2,
      "toolMaterial": "carbide",
      "surfaceTreatment": "TS",
      "sourceEvidence": [
        {
          "sourceId": "misumi-flat",
          "locator": "Specifications D=1, default shank d=4",
          "fields": [
            "manufacturer",
            "series",
            "geometry.diameterMm",
            "geometry.shankDiameterMm",
            "geometry.fluteLengthMm",
            "geometry.overallLengthMm",
            "flutes",
            "toolMaterial",
            "surfaceTreatment"
          ]
        }
      ],
      "machiningAuthorized": false,
      "notes": "Internal row ID is not a manufacturer order code. No neck geometry inferred from the 2D flute-length series label.",
      "threadUsage": null
    },
    {
      "id": "misumi-tsc-em2s-row-d2",
      "family": "flat_end_mill",
      "variant": "standard",
      "manufacturer": "MISUMI",
      "series": "TSC-EM2S",
      "orderCode": null,
      "recordStatus": "source_verified",
      "geometry": {
        "diameterMm": 2,
        "fluteLengthMm": 4,
        "overallLengthMm": 40,
        "shankDiameterMm": 4,
        "underNeckLengthMm": null,
        "neckDiameterMm": null,
        "ballRadiusMm": null,
        "includedAngleDegrees": null,
        "pointLengthMm": null,
        "pointDiameterMm": null,
        "maxAxialDepthMm": null,
        "maxCuttingDiameterMm": null,
        "connectionBoreDiameterMm": null,
        "functionalLengthMm": null,
        "threadLengthMm": null,
        "minimumDrillHoleDiameterMm": null,
        "maximumThreadDepthMm": null
      },
      "thread": null,
      "flutes": 2,
      "toolMaterial": "carbide",
      "surfaceTreatment": "TS",
      "sourceEvidence": [
        {
          "sourceId": "misumi-flat",
          "locator": "Specifications D=2, default shank d=4",
          "fields": [
            "manufacturer",
            "series",
            "geometry.diameterMm",
            "geometry.shankDiameterMm",
            "geometry.fluteLengthMm",
            "geometry.overallLengthMm",
            "flutes",
            "toolMaterial",
            "surfaceTreatment"
          ]
        }
      ],
      "machiningAuthorized": false,
      "notes": "Internal row ID is not a manufacturer order code. No neck geometry inferred from the 2D flute-length series label.",
      "threadUsage": null
    },
    {
      "id": "misumi-tsc-em2s-row-d3",
      "family": "flat_end_mill",
      "variant": "standard",
      "manufacturer": "MISUMI",
      "series": "TSC-EM2S",
      "orderCode": null,
      "recordStatus": "source_verified",
      "geometry": {
        "diameterMm": 3,
        "fluteLengthMm": 6,
        "overallLengthMm": 45,
        "shankDiameterMm": 6,
        "underNeckLengthMm": null,
        "neckDiameterMm": null,
        "ballRadiusMm": null,
        "includedAngleDegrees": null,
        "pointLengthMm": null,
        "pointDiameterMm": null,
        "maxAxialDepthMm": null,
        "maxCuttingDiameterMm": null,
        "connectionBoreDiameterMm": null,
        "functionalLengthMm": null,
        "threadLengthMm": null,
        "minimumDrillHoleDiameterMm": null,
        "maximumThreadDepthMm": null
      },
      "thread": null,
      "flutes": 2,
      "toolMaterial": "carbide",
      "surfaceTreatment": "TS",
      "sourceEvidence": [
        {